TourID,FacilityID,TourName,TourType,TourDescription,TourDuration,TourAccessible,CreatedDate,LastUpdatedDate
100,234640,Grand Avenue,Cave Tour,"Dramatic cave changes, dry cave vs. damp cave, gypsum, dripstone, and early exploration.",240,false,2014-05-02,2018-06-14
1006,250029,White House Easter Egg Roll,Historic Tour,White House Easter Egg Roll,0,true,2019-01-01,2018-01-01
10063833,10063832,Cape Lookout National Seashore Duck Blind Lottery Event,Nature Tour,Cape Lookout Duck Blind Event,1,false,2020-08-24,2020-08-24
10063834,10063832,Cape Lookout National Seashore Duck Blind Lottery,Nature Tour,Cape Lookout Duck Blind Event,1,false,2020-08-24,2020-08-24
10065449,10065448,Day Use Entry,Nature Tour,,540,false,2020-07-28,2020-07-28
1007,250029,White House Easter Egg Roll,Historic Tour,White House Easter Egg Roll,0,true,2019-01-01,2018-01-01
10072051,10072050,Stars Over Sand Beach,Nature Tour,"Maine’s striking coastline is often admired for its rugged rocks. Relax on Acadia’s only true sand beach with uninterrupted views of the night sky while Park Rangers share significant stories to help discover the intricacies of the stars.  
Acadia's Sand Beach, located just off the Park Loop Road, is a unique and exceptionally dark location for stargazing. Come join rangers as they share the natural history, inspiring stories, and an orientation to the night skies of Down East Maine. 
Sand Beach is not handicapped-accessible. Bring a towel or chair and dress warmly. Please limit the use of flashlights and use the red light setting when possible. Bring bug spray as there are insects on the beach.
Space is limited and reservations are required; no walk-ups will be permitted.",60,false,2020-08-18,2022-05-16
10073377,10073376,Multnomah Falls Tickets,Nature Tour,Timed reservation ticket is a per person ticket to enter the site.  All visitors to Multnomah Falls including infants will require a ticket. You may reserve up to 6 tickets per day. Your ticket reservation does not guarantee you a parking space. 300 tickets will be initially allocated on an hourly basis between 9:00 a.m.-6:00 p.m. to facilitate social distancing.,60,true,2020-08-27,2022-05-05
10075178,10075177,Scenic Drive Vehicle Entry,Nature Tour,Provides access for one private vehicle or up to two motorcycles or scooters to access the Scenic Drive including the Visitor Center and  all designated parking areas along the route. The average time spent along the Scenic Drive is approximately 8 hours.,60,false,2020-09-28,2020-09-28
10075179,10075177,Scenic Drive RV/Trailer Entry,Nature Tour,"Provides access for one RV/Trailer to access the Scenic Drive including the Visitor Center and a limited number of parking areas including: Calico Vista 1 , Sandstone Quarry, The High Point Vista, Willow Spring, Lost Creek and Pine Creek Vista. Other locations along the Scenic Drive cannot accommodate vehicles longer than 20 feet. The average time spent along the Scenic Drive is approximately 4 hours.",60,false,2020-09-28,2020-09-28
10075180,10075177,Scenic Drive Walk-in/Bicycle Entry,Nature Tour,"A timed entry reservation is not required. Upon your arrival, please visit the entrance kiosk to pay your entrance fee or have your pass validated. Ebikes are included in the category.",60,false,2020-09-28,2020-09-28
10075181,10075177,Scenic Drive Fee-Free Day RV/Trailer Entry,Nature Tour,"Red Rock Canyon National Conservation Area participates in entrance fee-free days. On these significant days of celebration or commemoration, all entrance fees are waived. For all other days, please make a reservation under the Scenic Drive Vehicle Entry or other applicable entry option.",60,false,2020-09-28,2020-09-28
10075182,10075177,Scenic Drive Fee-Free Day RV/Trailer Entry,Nature Tour,"Red Rock Canyon National Conservation Area participates in entrance fee-free days. On these significant days of celebration or commemoration, all entrance fees are waived. For all other days, please make a reservation under the Scenic Drive Vehicle Entry or other applicable entry option.",60,false,2020-09-28,2020-09-28
10075183,10075177,Scenic Drive Commercial Vehicle Entry,Nature Tour,"Provides access for commercial operators with a valid Bureau of Land Management Special Recreation Permit (SRP) or commercial operators driving the Scenic Drive and will not be providing additional visitor services (guided hikes, climbing, etc.). Commercial operators with a valid SRP must present their permit at the entrance station along with the timed entry reservation ticket.  All commercial operators with a valid SRP are allowed to have up to five vehicle reservations per tour time. Every vehicle in your group must have a timed entry reservation ticket. Those commercial operators driving the Scenic Drive and not providing additional visitor services (guided hikes, climbing, etc.) are permited to have five vehicle reservations per day for non-permitted commercial tours. Every vehicle in your group must have a timed entry reservation ticket.	Large commercial vehicles may access the Scenic Drive including the Visitor Center and a limited number of parking areas including: Calico Vista 1 , Sandstone Quarry, The High Point Vista, Willow Spring, Lost Creek and Pine Creek Vista. Other locations along the Scenic Drive cannot accommodate vehicles longer than 25 feet.",60,false,2020-09-28,2020-09-28
10075184,10075177,"Scenic Drive Education, Therapeutic, and Scientific Group Entry",Nature Tour,"Non-commercial vehicles such as school/educational groups, therapeutic groups, and scientific groups may be required to obtain this type timed ticket. To reserve a timed ticket for your group, you must contact the Bureau of Land Management (BLM) Education Office at (702) 515-5353 for a letter of agreement.  BLM staff will then assist you with your timed ticket reservation.  Once you have secured a letter of agreement and timed ticket reservation through the Education Office, please be ready to show your letter of agreement and timed ticket reservation on your arrival date at the entrance station.",60,false,2020-09-28,2020-09-28
10075185,10075177,Scenic Drive Low Season,Nature Tour,Scenic Drive Low Season,60,false,2020-09-28,2020-09-28
1008,234787,Sunrise Photo Tour,Historic Tour,Sunrise Photo Tour ,60,true,2019-02-11,2019-02-11
10086516,10086515,1-Day Personal Vehicle Day Use Tickets,Nature Tour,"Cochiti Day Use Area is open to the public for swimming, boating and fishing. Social distancing and COVID safe practices must be followed to ensure a safe and enjoyable time while at the lake. Each private vehicle entering the day use area will need a reservation ticket. Only one day use reservation is required for the vehicle and all the occupants. Please take time to ensure you follow all Pueblo regulations, and do not trespass on lands closed to public access.",660,false,2020-10-30,2020-10-30
10086549,10086548,Self-Guided Museum Tour,Historic Tour,"Canyons of the Ancients Visitor Center and Museum is a museum focusing on Ancestral Puebloan, Native American, and historic cultures in the Four Corners region.  It is also headquarters for visitors traveling to Canyons of the Ancients National Monument.
The museum features:
•	Permanent exhibits on archaeology, local history, and Native American cultures
•	Two 12th-century archaeological sites (Ask about visiting these pueblos just outside of the museum)
•	Rotating special exhibits and events
•	Educational resources for teachers and families
•	Internships for enrolled and recently graduated college students
•	Research library of archaeology and anthropology resources
•	Research collection of almost 4 million artifacts and records from archaeological projects in Southwest Colorado
•	Picnic area and half-mile nature trail to Dominguez and Escalante Pueblos",60,false,2021-04-01,2021-04-01
10086685,10086684,Winter Locomotive Demonstration Tickets 2020,Historic Tour,This ticket permits one person on the date and time specified to enter the Last Spike Site to attend the Winter Steam Festival and locomotive demonstration area.,60,true,2020-12-18,2020-12-18
10086722,10086721,1-Day San Gabriel OHV Vehicle Tickets,Nature Tour,"Primary Ticket: allows one day of admitance to San Gabriel Canyon OHV area for a primary vehicle. 

Secondary Vehicle: allows one day of admitance to San Gabriel Canyon OHV area for a secondary vehicle. A secondary vehicle is any vehicle that is brought in on a trailer or hauled in another vehicle. In order for secondary ticket ot be valid it must be purcahsed in conjunction with a primary ticket purchase.",480,false,2021-06-07,2022-05-04
10086746,10086745,Day Use Entry,Hike,"Ticket is for day use arrival for YOSE, reservation is for specific day to enter and park will calculate 7 day pass manually",1080,true,2021-01-29,2021-01-29
10086747,10086745,Day Use Entry (Entrance Fee-Free Days),Hike,"<p>Yosemite National Park participates in the National Park Service’s (NPS) entrance fee-free days. On these significant days of celebration or commemoration, all entrance fees are waived. For all other days, please make a reservation under the  <a href=""https://www.r1s-dev.com/timed-entry/10086745/ticket/10086746"">Day Use Entry page</a></p><p><b>Remaining 2020 Entrance Fee-Free Days:</b></p><dl><dd>Tuesday, August 25 – National Park Service Birthday</dd><dd>Saturday, September 26 – National Public Lands Day</dd><dd>Wednesday, November 11 – Veterans Day</dd></dl><p>To learn more about NPS Entrance Fee-Free Days, visit: https://www.nps.gov/orgs/1207/2020-fee-free-days.htm</p>",1080,true,2021-01-29,2021-01-29
10086811,234637,Self-Guided Tour,Cave Tour,"NOTE: Timed-entry tickets ONLY reserve a time slot to enter the cave. All park visitors must purchase or present a valid National Park pass upon arrival. Please visit www.nps.gov/cave/planyourvisit/fees.htm for information on entrance passes.\n\nThere are two ways to enjoy the cavern on a Self-Guided Tour - either by elevator, hiking, or both. Visitors may choose to hike the steep one and a quarter mile paved trail entering through the caverns Natural Entrance,which leads them into the spectacular one and a quarter mile Big Room Trail. Alternatively, you can simply take an elevator ride from the visitor center directly to the start of the Big Room Trail.",120,false,2021-03-12,2021-03-12
10086847,10086846,Garnet Area Tickets,Nature Tour,Allows three hours of admittance to Emerald Creek Garnet Area. Tickets are issued per person.  Ticket holders must be present on the day and time of the reservation.  Late arrivals will not be allowed an extension beyond the originally scheduled three hours.,180,false,2021-03-10,2022-05-04
10086911,10086910,Bear Lake Rd Corridor + Full Park Access,Historic Tour,2450 - across two hour windows,180,false,2021-04-30,2021-04-30
10086912,10086910,Park Access (Excludes Bear Lake Rd Corridor),Historic Tour,Remaining quota populated into park access,180,true,2021-04-30,2021-04-30
10086914,10086913,Teklanika Road Permit,Nature Tour,"Access to drive the Denali Park Road as far as Mile 30 Teklanika Rest Area. Permits issued in one hour blocks, but traffic will be allowed to enter only in first 45 minutes of the hour. There is a 15 minute pause in traffic to allow a gap in traffic flow for wildlife.",120,false,2021-04-16,2021-04-16
10086915,10086913,Eielson Road Permit,Nature Tour,"Access to drive the Denali Park Road as far as Mile 66 Eielson Visitor Center. Permits issued in one hour blocks, but traffic will be allowed to enter only in first 45 minutes of the hour. There is a 15 minute pause in traffic each hour to allow a gap in traffic flow for wildlife.",480,false,2021-04-16,2021-04-16
10086916,400000,Cadillac Sunrise - CUA Vehicle (21+ ft),Nature Tour,Cadillac Sunrise - CUA Vehicle (21+ ft),120,true,2021-03-23,2021-03-23
10086917,400000,Cadillac Daytime - CUA Vehicle (10-21 ft),Nature Tour,Cadillac Daytime - CUA Vehicle (10-21 ft),120,true,2021-03-23,2021-03-23
10086918,400000,Cadillac Daytime - CUA Vehicle (21+ ft),Nature Tour,Cadillac Daytime - CUA Vehicle (21+ ft),120,true,2021-03-23,2021-03-23
10086919,400000,Cadillac Sunrise - CUA Vehicle (10-21 ft),Nature Tour,Cadillac Sunrise - CUA Vehicle (10-21 ft),120,true,2021-03-23,2021-03-23
10086936,10086935,1-Day ORV Tickets,Nature Tour,Reservation to pick up Off Road Vehicle ticket.,5,true,2021-03-31,2021-03-31
10086943,251853,Parachute Shield Tour,Cave Tour,"Parachute Shield Tours are approximately 60 minutes long and travel about 0.35 miles. This tour is open to all ages. The Parachute Shield Tour visits the Lodge Room, The Inscription Room, the Cypress Swamp and the Grand Palace sections of Lehman Caves, including a chance to view the famous Parachute Shield formation. The tour is limited to 20 visitors. White Nose Syndrome screening is mandatory.",60,false,2021-03-31,2021-03-31
10086991,10086990,1-Day Ape Cave Tickets,Cave Tour,A reservation ticket is a per vehicle ticket to enter the site.  A limited number of vehicles will be permitted per 2-hour window.,60,false,2021-04-27,2021-04-27
10087087,10087086,Going-to-the-Sun Road Corridor 3-Day Vehicle Reservations,Nature Tour,"Entry tickets go on sale at 6 am Mountain Time on April 29th on a rolling 60-day window and daily starting May 27th 48 hours in advance also on a rolling window. Once your entry ticket is validated at the park, it is good for 7 consecutive days including the reserved day of arrival. Only one GTSR entry ticket is required per vehicle/motorcycle.",600,true,2021-04-22,2022-03-01
10087142,10087141,Golden Spike Commemoration Event,Nature Tour,"Golden Spike National Historic Park will commemorate the 152nd anniversary of the completion of the nation’s first transcontinental railroad on May 8, 9 and 10, 2021.  Events will include include the recreation of the historic “champagne photo”, a re-enactment of the original 1869 ceremony, steam locomotive demonstrations and exhibits of objects found along the historic railroad.",120,true,2021-04-26,2021-04-26
10087143,252034,Bodie Island Lighthouse Tickets,Cave Tour,,30,false,2022-04-06,2022-04-06
10087204,10087203,Crab Creek ,Nature Tour,This ticket allows parking at the western end of the Lewis River Recreation Area and access to the Lewis River Trail.,600,false,2021-05-18,2022-05-03
10087205,10087203,Lower Falls ,Nature Tour,"This ticket allows parking at Lower Falls Day Use area and requires an additional $5 day use fee, a Northwest Forest Pass, or America the Beautiful pass.  The site has vault toilets and picnic tables, and access to the Lewis River trail.",600,false,2021-05-18,2022-05-03
10087206,10087203,Middle Falls,Nature Tour,This ticket allows parking near the center of the Lewis River Recreation Area and allows access to the Lewis River Trail. It is the closest parking for viewing Middle Falls.,600,false,2021-05-18,2022-05-03
10087207,10087203,Upper Falls ,Nature Tour,This ticket allows parking near the Eastern portion of the Lewis River Recreation Area and allows access to the Lewis River Trail. It is the closest parking for viewing Upper Falls.,600,false,2021-05-18,2022-05-03
10087208,10087203,Wright Meadows ,Nature Tour,This ticket allows parking near the center of the Lewis River Recreation Area and allows access to the Lewis River Trail and Wright Meadows Trail.,600,false,2021-05-18,2022-05-03
10087209,10087203,Platinum Creek Parking (formerly Lewis River Parking),Nature Tour,"This ticket allows parking near the Eastern portion of the Lewis River Recreation Area and allows access to the Lewis River Trail via the Quartz Creek trail. This lot has a vault toilet and is within the Lewis River Horse Camp (first-come, first served camping available).",600,false,2021-05-18,2022-05-03
10087425,10087424,Apgar Visitor Center Ticket-to-Ride,Nature Tour,"You MUST arrive on the day you reserved during the hour of your reservation. Once your reservation is validated at the Apgar Visitor Center, you can board and disembark at any stop. One bus ticket is required for each rider over the age of 2 years.",60,true,2021-05-27,2021-06-02
10087426,10087424,St. Mary Visitor Center Ticket-to-Ride,Nature Tour,"You MUST arrive on the day you reserved during the hour of your reservation. Once your reservation is validated at the St. Mary Visitor Center, you can board and disembark at any stop. One bus ticket is required for each rider over the age of 2 years.",60,true,2021-05-27,2021-06-02
10087439,10087438,Mount Evans + All Recreation Sites Vehicle Ticket  ,Nature Tour,"Provides access for one private vehicle to access Mount Evans and all developed recreation sites. (Mount Goliath, Summit Lake Park, and the Summit Interpretive Area). The average time spent along the Scenic Drive is 2-3 hours.",120,true,2021-05-21,2022-05-03
10087440,10087438,Fee Free Days: Mount Evans + All Recreation Sites Vehicle Ticket,Nature Tour,"Provides access for one private vehicle or 1 motorcycle rider/scooter rider on the Fee Free Day to access Mount Evans and all developed recreation sites. (Mount Goliath, Summit Lake Park, and the Summit Interpretive Area). The average time spent along the Scenic Drive is 2-3 hours.",120,true,2021-05-21,2022-05-03
10087441,10087438,Mount Evans: Mt. Goliath Nature Center and Summit of Mt. Evans Interpretive Area Ticket,Nature Tour,Provides access for one private vehicle to access Forest Service developed recreation sites. (Mount Goliath and the Summit Interpretive Area only) The average time spent along the Scenic Drive is 2-3 hours.,120,true,2021-05-21,2022-05-03
10087442,10087438,Summit Lake Park Only Vehicle Ticket,Nature Tour,Provides access for one private vehicle to access Summit Lake Park only. The average time spent along the Scenic Drive is 2 hours.,120,true,2021-05-21,2022-05-03
10087443,10087438,Commercial Vehicle 1-Day Ticket,Nature Tour,"Provides access to the developed recreations sites for commercial operators who are not providing additional visitor services (guided hikes, climbing, etc.). This includes commercial test cars.",120,true,2021-05-21,2022-05-03
10087516,10087515,Mitchell Lake Trailhead - Day Use Parking,Nature Hike,Provides day use parking for one private vehicle in the  Mitchell Lake Trailhead parking lot. Visitors spend about 3-5 hours in the Indian Peaks Wilderness Area.,180,true,2021-05-21,2022-05-03
10087517,10087515,Long Lake Trailhead - Day Use Parking,Nature Hike,Provides day use parking for one private vehicle in the Long Lake Trailhead parking lot. Visitors spend about 3-5 hours in the Indian Peaks Wilderness Area.,180,true,2021-05-21,2022-05-03
10087518,10087515,Niwot Picnic Site/Trailhead - Day Use Parking,Nature Hike,Provides day use parking for one private vehicle in the Niwot Picnic Site/Trailhead parking lot. Visitors spend about 3-4 hours in the Indian Peaks Wilderness Area.,180,true,2021-05-21,2022-05-03
10087519,10087515,Brainard Lake Picnic Site/Trailhead - Day Use Parking,Nature Hike,Provides day use parking for one private vehicle in the Brainard Lake Day Use parking lot. Visitors spend 2-3 hours around Brainard Lake or 3-5 hours in the Indian Peaks Wilderness Area.,180,true,2021-05-21,2022-05-03
10087520,10087515,Red Rock Lake Picnic Site - Day Use Parking,Nature Hike,Provides day use parking for one private vehicle in the Red Rock Lake parking lot. Visitors spend up to 2-3 hours fishing or hiking nearby trails.,180,true,2021-05-21,2022-05-03
10087521,10087515,Overnight Parking Permit - Mitchell Lake,Nature Hike,Provides overnight parking for one private vehicle for the duration of the IPW backpacking trip. Visitors must have a valid Indian Peaks Wilderness overnight camping permit prior to obtaining this ticket type.,180,false,2021-05-21,2022-05-03
10087522,10087515,Overnight Parking Permit - Long Lake,Nature Hike,Provides overnight parking for one private vehicle for the duration of the IPW backpacking trip. Visitors must have a valid Indian Peaks Wilderness overnight camping permit prior to obtaining this ticket type.,180,false,2021-05-21,2022-05-03
10087523,10087515,Overnight Parking Permit - Niwot Picnic,Nature Hike,Provides overnight parking for one private vehicle for the duration of the IPW backpacking trip. Visitors must have a valid Indian Peaks Wilderness overnight camping permit prior to obtaining this ticket type.,180,false,2021-05-21,2022-05-03
10087524,10087515,Overnight Parking Permit - Brainard Lake,Nature Hike,Provides overnight parking for one private vehicle for the duration of the IPW backpacking trip. Visitors must have a valid Indian Peaks Wilderness overnight camping permit prior to obtaining this ticket type.,180,false,2021-05-21,2022-05-03
10087703,10087702,Minnetonka Cave Tour,Cave Tour,"Cave opens around Memorial Weekend and closes Labor Day Weekend, depending on snow. The cave is open 7 days a week from 10 a.m. Tours run every half hour or more often. The last tour starts at 5:30 p.m.",80,false,2022-08-09,2022-08-09
10087802,10087801,Top of the Dam Guided Tour,Historic Tour,"Cancellation Window / Refunds in CT:
Participants must check-in/pick up tickets at the Mount Morris Dam and Recreation Area Visitor Center at least 15 minutes prior to the Guided Walk start time. Otherwise, reservations will be cancelled and tickets forfeited. No refunds will be offered.",60,false,2021-07-16,2021-07-16
10088010,10088009,Laurel Falls Trailhead Parking,Nature Hike,Parking reservation tickets go on sale on August 16th at 10 am EST. Tickets are available on a rolling window starting August 30th. Only one parking reservation ticket is required per vehicle.,120,false,2021-08-17,2021-08-17
10088102,10087438,Mount Evans: Mount Goliath and Summit Lake Park Vehicle Ticket ,Entry Ticket,Provides access for one private vehicle. This ticket includes Mount Goliath and Summit Lake Park.  The average time spent along the Scenic Drive is 2-3 hours.,120,true,2022-05-03,2022-05-03
10088104,10088103,Scenic Tour,Cave Tour,"The Scenic Tour route provides an opportunity to visit various cave chambers and passages decorated with calcite crystals and other speleothems. This tour is considered a modern-day walking tour along a paved trail with electric lighting. The tour enters and leaves the cave by elevator in the visitor center. The Scenic Tour is moderately strenuous and lasts 1 hour and 20 minutes.
The tour route involves walking up and down 734 stair steps along a 1/2-mile (.8 km) loop, (equivalent to 40 flights of stairs). During the Scenic Tour, you will see two types of calcite crystals known as nailhead spar and dogtooth spar, which are the ""jewels"" of Jewel Cave. In addition, you can view boxwork, cave popcorn, flowstone, stalactites, stalagmites, draperies, and a long ribbon drapery called the cave bacon. With each visit, you will learn more about the cave formations, discovery and continuous exploration.
NOTE: Wheelchairs, scooters, and other mobility devices are not allowed on the Scenic Tour. Individuals with physical or mobility limitations may wish to contact the monument directly at (605) 673-8300 for additional programming",80,false,2021-12-10,2021-12-10
10088105,10088103,Discovery Tour,Cave Tour,A 20-25 minute ranger presentation inside the first room of the ever-popular Scenic Tour route. This presentation is universally accessible.,20,true,2021-12-10,2021-12-10
10088308,10088307,Fort Point Candlelight Tour,Historic Tour,The Candlelight Tour of Fort Point is a guided interpretive program of the entire fort after dark which allows for a new sensory experience for park visitors. The fort closes to the public at 5pm. This is when the assigned ranger will begin to prepare for the arrival of visitors at 6:15pm to distribute lanterns and allow visitors the chance to use the restroom before entering the fort. At 6:30pm visitors with reservations will begin their tour when the fort is otherwise inaccessible to the public. The Park Ranger will interpret the history and the life that once existed within the old brick walls of Fort Point that will engage audience in dialogue. Rangers will explore its cultural relevancy today through the lens of contrasts and juxtapositions of personal identities.,90,false,2021-10-21,2021-10-21
10088309,10088311,Pearl Harbor Lottery Event,Historic Tour,placeholder,1,true,2021-10-28,2021-10-28
10088312,10088311,Pearl Harbor Lottery Event,Historic Tour,placeholder,1,true,2021-10-28,2021-10-28
10088381,10088380,Pearl Harbor Lottery Event,Historic Tour,placeholder,1,true,2021-10-28,2021-10-28
10088382,10088380,Pearl Harbor Lottery Event,Historic Tour,placeholder,1,true,2021-10-28,2021-10-28
10088427,10088426,1-Day Personal Vehicle Timed Entry,Entry Ticket,Provides access for one private vehicle to access the main Scenic Drive in Arches and all designated parking areas along the route if spots are available through the main entrance.,60,true,2021-12-14,2021-12-14
10088441,10088440,Academic Teacher-Guided Tour,Historic Tour,"This ticket is used for academic institutions performing an educator guided tour with no commercial tour company. Academic fee waivers must be received no later than 3 weeks prior to arrival to be processed and approved.
Visiting “Teacher-led” means your students will tour the fort under your supervision, instead of exploring with a licensed tour guide. It is your responsibility to prepare your students and their accompanying chaperones for the visit. To assist you, the park has put together field trip guidance for your visit: Teacher-led School Groups.

The park has also put together Pre and Post Field Trip activities.",30,false,2022-06-15,2022-06-15
10088442,10088440,Commercial Guided Tour,Historic Tour,This ticket used by any commercial tour company that holds a current Commercial Use Authorization with the National Park Service at this location.,30,false,2022-06-15,2022-06-15
