TourID,FacilityID,TourName,TourType,TourDescription,TourDuration,TourAccessible,CreatedDate,LastUpdatedDate
10089670,10089669,K-12th: Education Field Trip,Historic Tour,"Bring your students to Campbell Creek Science Center to explore Alaska's natural world. The Campbell Creek Science Center's dynamic education programs spark curiosity and build connections with nature for students. CCSC offers a variety of program topics. You will indicate your group’s grade and program topic choice in the text field for grade when you check out. The Science Center is the perfect outdoor classroom where learning and science come to life. Here, everyone is a scientist. Let us guide your journey. 

Program Theme Options (3-hours long):
K – 3rd | A Seed’s Journey | All Year
K – 3rd | Alaska Animals | All Year
2nd– 3rd | Plant Explorers | Fall & Spring
4th– 6th | What makes a healthy watershed? | Fall & Spring
4th– 6th | Forest Ecosystems | Fall & Spring
4th – 6th | Dynamic Earth | All Year
4th – 12th | Team Building | All Year
4th – 12th | Outdoor Survival Skills | All Year
Visit our website to learn more about these program options. 


•	Program Length: Half-Day (up to three hours): 
•	Program Cost: $12 per student. Note: You will be charged a $130 deposit when you book this program. This deposit covers the cost of 10 students and the non-refundable processing fee. If your group has more than 10 students you will need to pay the remainder of the program fee ($12/student) on or after the day of your program, minus the deposit. Science Center staff will provide more information including details about your remaining balance after you book your program. 
This program takes place primarily outdoors. Temperatures can be 10 degrees colder than other parts of Anchorage. Ensure students and chaperones come dressed for the weather, including layers and proper footwear for indoor and outdoor activities.
All CCSC programs are aligned with Next Generation Science Standards and science content standards for Alaska. Programs are fully accessible. Notify CCSC in advance of any special needs or requirements for your group. An all-terrain wheelchair is available for participants with mobility impairments.",180,true,2022-07-22,2022-07-22
10089704,10089703,Melrose Mansion Guided Tour,Historic Tour,"Admission for one adult, age 16 or over for a guided tour of the Melrose mansion.",45,false,2022-08-09,2022-08-09
10089705,10089703,Melrose Mansion Guided Group Tour,Historic Tour,"Admission for one adult, age 16 or over for a guided tour of the Melrose mansion.",46,false,2022-08-09,2022-08-09
10089707,10087702,Minnetonka Cave Group Tour,Cave Tour,,80,false,2022-08-09,2022-08-09
10089741,10089740,Boulder Cave Day Use,Cave Tour,Boulder Cave trail is a highly used trail leading to the cave.  The trail is dirt and becomes rougher as you descend into the canyon at the cave entrance.  From the parking area the trail leads uphill for approximately 3/4 of a mile.  The hardest part of the hike is walking up the trail from the cave exit.,720,false,2022-08-11,2022-08-11
10089812,10089811,Day Use Ticket / Boleto Para Uso Diario,Historic Tour,"Explore, discover and connect at El Portal de El Yunque Visitor Center! The center is a per person enrance that provides access to exhibits, the El Yunque movie, art installations, daily scheduled ranger talks, two nature trails (one wheelchair/ADA accessible) and special programs! El Portal de El Yunque is a seperate destination from other sites within El Yunque that may require a seperate reservation.",480,true,2022-09-21,2022-09-21
10089813,10089811,Commercial Day Use Ticket / Boleto Commercial Para Uso Diario,Historic Tour,All official outfitter and guide permit holders can use their account to purchase these dedicated tickets. These commercial tickets are not available to non-permittees. The purchase of public tickets for use by commercial providers will not be honored.,480,true,2022-09-21,2022-09-21
10089884,10089883,Evening Candlelight Tour,Historic Tour,"The Evening Candlelight Tour provides participants with a tour of the fort’s rooms where living history staff and volunteers will provide a view into the lives of fort workers, Plains Indians, travelers, soldiers and Mexican families, who were at Bent’s Old Fort in the 1830s and 1840s.",60,false,2022-10-14,2022-10-14
10089885,10089883,School Group Tour X,Historic Tour,School group tour,60,false,2022-10-14,2022-10-14
10089886,10089883,School Group Tour Y,Historic Tour,School group tour,60,false,2022-10-14,2022-10-14
1009,234636,Douglass Home Group Tour,Historic Tour,"Tour the Victorian mansion that was the last residence of famed abolitionist, statesman, and orator, Frederick Douglass",30,true,2019-02-13,2019-02-13
101,233266,Adult Annual Pass,Pass,Adult Annual Pass,0,false,2014-05-02,2018-06-14
1010,233374,The Great Smoky Mountains Firefly Viewing Lottery,Nature Tour,The Great Smoky Mountains Firefly Viewing Lottery,120,true,2019-01-01,2021-05-07
1011,233374,The Great Smoky Mountains Firefly Viewing,Nature Tour,The Great Smoky Mountains Firefly Viewing,120,true,2019-01-01,2021-05-07
1012,234640,Extended Historic Tour,Cave Tour,"Large trunk passages, oldest tour route and cultural history.",135,false,2019-03-21,2019-03-21
1013,233362,Cliff Palace Early Bird Tour,Cliff Dwelling Tour,"Photographers, and those who would like to visit the famous Cliff Palace through the historical photographers lens, take this opportunity to spend 90 minutes in Cliff Palace with a park ranger in a small group setting. Tripods and all kinds of cameras are welcome. BUT YOU MUST BE ABLE TO CARRY ALL OF YOUR GEAR WHILE KEEPING YOUR HANDS FREE TO CLIMB LADDERS. <br><br>Meet the ranger on the overlook above Cliff Palace at least 15 minutes in advance of the tour. Drive time to the Cliff Palace overlook from the park entrance is approximately one hour.",90,false,2019-03-25,2019-03-25
1014,233405,Life on the Lake Tour,Boat Tour,"Boards at the Rainy Lake Visitor Center, 1797 Town Road 342, International Falls, MN 56649. Discover the wonders and beauty of Voyageurs National Park. The captain will navigate Rainy Lake in search of active eagle nests and abundant wildlife. The boat will dock at Harry Oveson’s Fish Camp, one of the last commercial fishing camps on the Minnesota side of Rainy Lake, for a ¼ mile walk to view an ice house, fish processing shed and fisherman’s home. Tour runs from 11am - 1pm June 19 through August 31 on Wednesdays and Saturdays.",120,true,2019-04-10,2019-04-10
1016,233373,Gordon Meadows,Nature Tour,"Hikers will experience a meadow, wetlands, old growth trees and, cross country travel to a historic trail shelter location and the ”edge of the world” site. Great views all around.",360,false,2019-05-17,2019-05-17
1017,233373,Art in Nature - Parish Lake,Nature Hike,"Join our adventure on this moderate to easy ~2 mile hike to where the spring flowers thrive! While the exact location of this hike will depend on how the flower season progresses, you will still need the creative art materials of your choice, a lunch, and a sense of adventure. For some, art is more than drawing and painting. If art to you is taking photos or if you’re artistic inspiration comes from observing and meditating in nature, feel free to join us. Be prepared to visit the home of the flowers for several hours to ”Art” and experience the place at rest.",360,false,2019-05-17,2019-05-17
1018,233373,Art in Nature - Along the Middle Santiam,Nature Hike,Bring your art supplies and a sense of adventure to have an art filled experience in the great outdoors. ,360,false,2019-05-17,2019-05-17
1019,233373,Art in Nature - Art from Nature,Nature Hike,"Join our adventure on this moderate to easy ~2 mile hike to where the spring flowers thrive! While the exact location of this hike will depend on how the flower season progresses, you will still need the creative art materials of your choice, a lunch, and a sense of adventure. For some, art is more than drawing and painting. If art to you is taking photos or if you’re artistic inspiration comes from observing and meditating in nature, feel free to join us. Be prepared to visit the home of the flowers for several hours to ”Art” and experience the place at rest.",360,false,2019-05-17,2019-05-17
102,233266,Interagency Annual Passport,Pass,Interagency Annual Pass,0,false,2014-05-02,2018-06-14
1020,300003,Full Guided Tour,Historic Tour,"Enjoy the full Adams experience by touring the Birthplaces of Presidents John and John Quincy Adams, as well as Old House at Peace field.  Trolley will connect you to all sites.",120,false,2019-05-21,2019-05-21
1021,300003,Birthplaces,Historic Tour,"Enjoy a guided tour of the two oldest Presidential Birthplaces in the nation.  Learn how growing up on a farm at the foot of Penn's Hill helped shape the opinons, politics, and lives of future presidents John Adams and John Quincy Adams.",30,false,2019-05-21,2019-05-21
1022,300003,Old House at Peace field,Historic Tour,"Purchased by John and Abigail Adams in 1787, see the home that the Adams family would retreat to escape politics.  From First Ladies to Diplomats, Old House at Peace field provides an intimate glimpse into the lives of the Adams Family.",60,false,2019-05-21,2019-05-21
1027,250795,"Kayak Adventure: Orleans, Eastham, and Wellfleet",Nature Tour,,180,true,2019-06-21,2019-06-21
1028,250795,"Kayak Trip: Evening on Gull Pond, Wellfleet",Nature Tour,,90,true,2019-06-21,2019-06-21
1029,250795,"Wet N Wild Activity, Wellfleet",Nature Tour,,90,true,2019-06-21,2019-06-21
103,233266,Senior Annual Pass,Pass,Senior Annual Pass,0,false,2014-05-02,2018-06-14
1030,250795,"Wet N Wild Activity, Provincetown",Nature Tour,,90,true,2019-06-21,2019-06-21
104,234640,Violet City Lantern,Cave Tour,"Lantern-light experience, prehistoric cave users, 19th century tours, early cave exploration and commercial uses.",180,false,2014-05-02,2018-06-14
1040,300004,Keys Ranch Tour,Historic Tour,"Discover the colorful lives of Bill and Frances Keys and learn how they survived and raised a family in the harsh desert environment on the Keys Ranch Tour. Explore the ranch house, school room, store, workshop, and more treasures from the 60 years the Keys called this area home. Listed on the National Register of Historic Places in 1975, the property is located in a remote, rocky canyon in Joshua Tree National Park. To preserve its historic character, admission to the ranch is restricted to guided walking tours. The tours are a half-mile in length and last 90 minutes. Group size is limited to 25 people.",90,false,2019-07-10,2019-07-10
105,234640,River Styx,Cave Tour,"Geologic development, water continuing to impact the cave.",150,false,2014-05-02,2018-06-14
106,234640,Frozen Niagara,Cave Tour,"Focus on formation of cave, development of dripstone and animal life.",75,false,2014-05-02,2018-06-14
1060,300005,Carl Sandburg Home Tour,Historic Tour,Taking a guided tour of the historic Carl Sandburg Home is an insightful glimpse into the lives of the Sandburg family. Tours of the home include access to 11 furnished rooms over the top two floors of the three story house.,30,false,2019-09-12,2020-12-03
107,234640,Passage Tour,Cave Tour,"Follow your guide to the Historic Entrance where the cave was first discovered more that 4,000 years ago.",75,false,2014-05-02,2018-06-14
1070,300006,Bison Bonebed Tour,Historic Tour,"See one of the most important paleo-archeological discoveries in North America within the bonebed enclosure at the Hudson-Meng visitor center. Learn about the mystery of the bison deaths and evidence that supports a variety of theories on what happened. This interpretive tour is led by Forest Service Rangers who will present scientific findings, theories, and demonstrations. Visitors gain a better understanding of the bonebed’s significance and they learn about the history of Paleo-Indians after Ice Age.  The tour is approximately 45 minutes. ",60,true,2019-12-31,2019-12-31
108,234640,Discovery Tour,Cave Tour,"Visit the Rotunda, one of the largest rooms in the cave; explore a vast canyon passageway; and learn about 19th-century saltpeter mining operations and the geologic origins of Mammoth Cave on this self-guiding tour.",20,false,2014-05-02,2018-06-14
1080,300007,Morrow Point Boat Tour,Boat Tour,"Watch the steep walls of the Black Canyon slide by, see a hidden waterfall, and connect with the Gunnison country’s geologic history, and scenic wonders on the calm waters of Morrow Point Reservoir. Hear stories of adventure and challenge, narrow-gauge railroads and water development from knowledgable park rangers.",90,true,2020-01-28,2020-01-28
109,234640,Snowball Tour,Cave Tour,"Descend and ascend nearly 200 stairs at the Carmichael Entrance of Mammoth Cave, pass the craggy breakdown of the Rocky Mountains and enter gypsum encrusted Cleaveland Avenue.",180,false,2014-05-02,2018-06-14
1090,300008,Firefly Event,Nature Tour,"Have you ever wanted to take a canoe trip on Cedar Creek with a park ranger? The park offers a limited number of free guided canoe tours each year allowing visitors to experience the Congaree Wilderness in a unique way. While on the creek, rangers will talk about the natural and cultural history of the last remaining old-growth buttomland forest in the United States. Visitors will see large bald cypress, loblolly pine and a variety of wildlife while on the tour. Would you like to join us?",180,false,2020-01-28,2022-03-02
1091,300008,Congaree Fireflies Festival,Nature Tour,"Have you ever wanted to take a canoe trip on Cedar Creek with a park ranger? The park offers a limited number of free guided canoe tours each year allowing visitors to experience the Congaree Wilderness in a unique way. While on the creek, rangers will talk about the natural and cultural history of the last remaining old-growth buttomland forest in the United States. Visitors will see large bald cypress, loblolly pine and a variety of wildlife while on the tour. Would you like to join us?",180,false,2021-04-08,2022-03-02
11,233405,Kettle Falls Cruise (Kabetogama Lake),Boat Tour,Voyage to the Historic Kettle Falls Hotel.  This tour takes you on a cultural and natural history tour of the park.  Spend 2 hours aboard the Borealis Tour Boat getting to the hotel. Once at the hotel spend 2 hours on land dining and touring the site and dam.  Then spend 1.5 hours on your return route.,330,false,2014-05-02,2018-06-14
110,250006,Standing General Admission,Historic Tour,Standing General Admission,0,false,2014-05-02,2018-06-14
1100,300003,Pen and Parchment School Group Program,Historic Tour,"Have your students take part in the American Revolution!  Students assume the roles of delegates to the Continental Congress and \""journey\"" from John and Abigiail Adams' farm to Pennsylvania to take part in the crucial debate over the Declaration of Independence and, finally, to sign it.",90,false,2020-02-26,2020-02-26
1110,233373,Family Fall Foliage,Nature Tour,Enjoy three easy to moderate hikes for the whole family to view fall foliage. Children under 18 must be accompanied by an adult.  Bring your camera.,460,false,2020-03-13,2020-03-13
115,234640,Gothic Avenue Tour,Cave Tour,"Some areas of Mammoth Cave just seem magical, and Gothic Avenue is one of those special places.  This tour begins at the Visitor Center and enters that now famous entrance, as the ranger interprets areas including the Rotunda, the Church, Giants Coffin, and the TB Huts. Gothic Avenue is also included in the Star Chamber Tour that is offered during spring, summer and fall.",120,false,2014-05-02,2018-06-14
116,234668,Fiery Furnace Loop Tour,Hike,"The Fiery Furnace offers a labyrinth of narrow passageways and abrupt dead-ends among a series of sandstone fins. Though it does not encompass a very large area, it is easy to become disoriented or lost.",150,false,2014-05-02,2018-06-14
117,233244,Painted Rock Guided Tour,Historic Tour,"The tour begins at the Soda Lake Overlook at 10:00am. After an introduction and brief history of the Carrizo, the group will explore Soda Lake and the Carrizo Plains plant communities, with general wildflower identification.",180,false,2014-05-02,2018-06-14
118,233244,Painted Rock Self Guided Tour,Historic Tour,"The sandstone formation at Painted Rock has long drawn the attention of Carrizo Plain visitors.  About 3,000 - 4,000 years ago, Native Americans began to paint their sacred images within the alcove of the rock.  Not surprisingly, the power of this place continues to enthrall, and it still receives many visitors today.The Painted Rock Self Guided Tour Gives you a unique experience you cannot get any other place in the world.  It is a 1.4 mile round trip hike where you get to experience Painted rock and its wonderful Native American Pictographs ",90,false,2014-05-02,2018-06-14
119,233244,Saucito Ranch Tour,Historic Tour,The tours meet at the Goodwin Education Center off of Soda Lake Road at 10 a.m. and will caravan up to the ranch. Visitors should bring a sack lunch to enjoy while sitting on the ranch house veranda at the tour conclusion. ,150,false,2014-05-02,2018-06-14
12,233405,Ellsworth Rock Gardens Tour and Eagle Watch,Boat Tour,"Board the Borealis and cruise Kabetogama Lake in search of active eagle nests and other wildlife. At the gardens, join a ranger for a 1/4 mile tour (not accessible) of the unique rock sculptures, building remnants, and winding paths.",120,false,2014-05-02,2018-06-14
120,234645,Self-Guided Timed Entry,Historic Tour,"Self-guided timed Entry is offered every 15 mins. beginning at 10:30 a.m. to 90 minutes before closing, daily. Individuals may reserve up to 20 spaces and groups may reserve up to 100 spaces (large groups please book through the <a href=http://www.recreation.gov/tourSwitchSalesCategoryDisplay.do?contractCode=NRSO&parkId=79052&target=tourList/>group sales</a> section of the website).  Plan for a 90-minute visit to the Charters of Freedom (home to the Declaration, Constitution, and Bill of Rights), the Public Vaults permanent exhibit gallery, the OBrien temporary exhibit gallery, the Boeing Learning Center, and the David M. Rubenstein Gallery.",0,true,2014-05-02,2018-06-14
121,234645,Tour (Docent-Guided),Historic Tour,"While National Archives visitors guide themselves through the museum. Once per day, Monday through Friday, at 9:45 a.m we offer a 1-hour docent-led guided tour of the National Archives Museum. Individuals and groups may reserve up to 15 spaces. The tour includes the Rotunda for the Charters of Freedom (home to the Declaration of Independence, Constitution, and Bill of Rights) and the Public Vaults permanent, interactive exhibit gallery. ",60,true,2014-05-02,2018-06-14
122,233266,Discovery in the Dark Headlamp Tour,Cave Tour,"Discovery in the Dark Headlamp Tours take visitors into the last part of the Discovery Trail. The cave lights are off, and visitors will use helmet-mounted lights to get a look at life in the dark.",60,false,2014-05-02,2018-06-14
123,233266,Discovery Trail Tour,Cave Tour,"The Discovery Trail follows the path of the first explorers through large water-carved passages, under the natural entrance and along the cave stream.",90,false,2014-05-02,2018-06-14
124,233266,Wild Cave Tour,Cave Tour,"The Wild Cave Tour takes visitors through the undeveloped sections of the middle level of Blanchard. All gear is provided except boots. Particpants must wear boots with good ankle support and aggressive tread. The tour ends at the Titans formations. Participants must be at least ten years old, and ten to twelve year olds must be accompanied by a responsible adult. Each tour must have a minimum of 3 participants.",300,false,2014-05-02,2018-06-14
125,233266,Dripstone Trail Tour,Cave Tour,"The Dripstone Trail Tour travels through two huge rooms filled with an incredible variety and number of crystalline formations - sparkling flowstone, towering columns, and delicate soda straws. This shorter, easier trail takes visitors almost half a mile through the Caverns.",60,false,2014-05-02,2018-06-14
126,233266,Forest Seasonal Day Use Pass,Pass,Forest Seasonal Day Use Pass,0,false,2014-05-02,2018-06-14
127,233266,Senior Lifetime Pass,Pass,Senior Lifetime Pass,0,false,2014-05-02,2018-06-14
128,233266,Group Dripstone Trail Tour,Cave Tour,"The Dripstone Trail Tour travels through two huge rooms filled with an incredible variety and number of crystalline formations - sparkling flowstone, towering columns, and delicate soda straws. This shorter, easier trail takes visitors almost half a mile through the Caverns.",60,false,2014-05-02,2018-06-14
129,233266,Group Discovery Trail Tour,Cave Tour,"The Discovery Trail follows the path of the first explorers through large water-carved passages, under the natural entrance and along the cave stream.",90,false,2014-05-02,2018-06-14
130,233266,Interagency Access Passport,Pass,Interagency Access Passport,0,false,2014-05-02,2018-06-14
131,233282,Lower Vine Ranch Hike,Historic Tour,"Lower Vine Ranch was where Scotty lived - not Scottys Castle. Scottys modest cabin, garage, small blacksmith shed, grain shed, and corrals are seen on this 2-mile round trip ranger-guided hike over uneven surfaces.",150,false,2014-05-02,2018-06-14
132,233282,House-Underground Combo Tour,Combo Tour,House-Underground Combo Tour,0,false,2014-05-02,2018-06-14
133,233282,Underground Tour,Historic Tour,"1-hour walking tour of basement, tunnels and power house, focuses on 1920s technology used at Scottys Castle.",60,false,2014-05-02,2018-06-14
134,233282,House Tour,Historic Tour,Guided walking tour through main rooms in Scottys Castle.,60,false,2014-05-02,2018-06-14
135,233282,Group House Tour,Historic Tour,Guided walking tour through main rooms in Scottys Castle.,0,false,2014-05-02,2018-06-14
136,233282,Group Underground Tour,Historic Tour,"1-hour walking tour of basement, tunnels and power house, focuses on 1920s technology used at Scottys Castle.",0,false,2014-05-02,2018-06-14
137,233274,Guevavi and Calabazas Missions Tour,Historic Tour,"The ruins of Guevavi and Calabazas Missions, protected as a part of Tumacacori National Historical Park and normally closed to the public,can be visited as a participant in these special reserved tours.",240,false,2014-05-02,2018-06-14
138,234166,Picket Wire Canyonlands Guided Auto Tour,Historic Tour,Guided Auto Tour of Picket Wire Canyonlands. Home to the largest dinosaur tracksite in North America,480,false,2014-05-02,2018-06-14
14,233405,Grand Tour,Boat Tour,"Discover the wonders and beauty of Voyageurs National Park.  The captain will navigate Rainy Lake in search of active eagle nests, abundant wildlife, and a historic commercial fishing camp. This tour includes a stop at Little American Island (1/4 mile accessible walk) where gold was discovered in the 1890s.",150,true,2014-05-02,2018-06-14
142,234787,Audio Kiva Trail  Tour,Historic Tour,"Take as much time as you need on this self-guided tour while you stroll along the paved Great Kiva Trail and make your way toward a 44-foot diameter excavated great kiva and an excavated pit house, a typical residence of the ancient ones and a sacred archeoastronomy site.  A Site Monitor will be available to answer questions about the story of the people who lived at the Monument 1,000 years ago. This tour does not require reservations but you will still need to check-in at the cabin. ",0,true,2014-05-02,2018-06-14
143,234787,Full Moon & Early Tour Package,Historic Tour,"Early tour: If youve never been to Chimney Rock National Monument, take this opportunity to learn more about the people who lived in this wondrous site 1,000 years ago. Youll walk the one-third-mile Great Kiva Trail with a tour guide, then climb the Pueblo Trail in time for the Full Moon program",240,false,2014-05-02,2018-06-14
144,234787,Night Sky: Our Solar System,Historic Tour,"Your evening begins with a one hour interactive discussion at the Visitor Center on the archaeoastronomy of Chimney Rock and a preview of what guests may expect to see with telescopes. Topics range from astronomy, what the full moon meant to the Ancient People, and how a telescope helps us see stars. As darkness descends, guests drive to the High Mesa parking lot where volunteer astronomers await with telescopes to provide a closer look at the full moon. Focus will shift to deeper-sky objects plus any man-made objects that come into view. This program is perfect for young families and those with limited mobility.",210,true,2014-05-02,2018-06-14
145,234787,Moon View,Historic Tour,"At the conclusion of the full moon program you will hike down to the parking lot where telescopes will be set up for the full moon viewing. Volunteer astronomers will be on hand to explain different features of the moon and answer any questions you may have. Dont miss the moon in its full glory at this wonderful program. This is a $5 add-on to the $15 full moon program and tickets are non-refundable, rain or shine.",120,false,2014-05-02,2018-06-14
146,234787,Early Tour,Historic Tour,"If youve never been to Chimney Rock National Monument, take this opportunity to learn more about the people who lived in this wondrous site 1,000 years ago. Youll walk the one-third-mile Great Kiva Trail with a tour guide, and then climb the Pueblo Trail in time for the full moon program.  Guests will see a 44-foot diameter excavated great kiva on this early tour. Also on this easy trail, theres an excavated pit house, a typical residence of the ancient ones. This is a $5 add-on to the other program and tickets are non-refundable, rain or shine.",60,false,2014-05-02,2018-06-14
