TourID,FacilityID,TourName,TourType,TourDescription,TourDuration,TourAccessible,CreatedDate,LastUpdatedDate
15,233405,Kettle Falls Cruise (Rainy Lake),Boat Tour,"Voyage to the Historic Kettle Falls Hotel.  This tour takes you on a cultural and natural history tour of the park.  Spend 2.5 hours aboard the Voyageur getting to the hotel. Once at the hotel spend 2 hours on land, dining and touring the site.  Then spend 2 hours on your return route.",390,false,2014-05-02,2018-06-14
151,250006,Seated General Admission,Historic Tour,Seated General Admission,0,false,2014-05-02,2018-06-14
152,249985,Sailing on Alma,Historic Tour,"Haul lines to raise the sails with National Park Service Rangers as you explore the Bay aboard the historic 60 foot Alma! Take in dazzling views and San Franciscos riveting history: Native Americans, Spanish explorers, the Gold Rush, lighthouses, the Barbary Coast, Fishermans Wharf, earthquakes, shipbuilding and more! Before highways and bridges, hundreds of scow schooners like Alma plied San Francisco Bay, hauling goods as the flatbed trucks of their day. The last of her kind, Alma will transport you to a long ago era on this unique, hands-on, educational sailing program with the National Park Service. Sailing runs on selected days from  June to November. ",210,true,2014-05-02,2018-06-14
154,249993,Introduction to Caving Tour,Cave Tour,"The ranger-led, 1.5 hour Introduction to Caving Tour introduces visitors to the sport of caving. Although not a wild caving experience, the tour requires bending, crawling, and good physical condition. The tour is limited to 5 people, age 14 or older, and requires advanced tickets.   Add an additional 2+ hours for hiking to and from the caves. (Approx. 3 hours round trip)",240,false,2014-05-02,2018-06-14
155,249993,Cave Tour,Cave Tour,"All cave tours are guided by a park ranger. The regular  tour through all three caves lasts about an hour on a paved, lighted route. Touring the cool wet caves requires some bending and crouching. The caves are 45 F, 8 C. It is very common for these tours to sell out daily during the summer season. ",210,false,2014-05-02,2018-06-14
157,250795,"Yoga on the Beach: Herring Cove Beach, Provincetown",Nature Tour,Yoga at the Cove: Provincetown,75,false,2014-06-19,2019-06-23
159,250795,Hike: Roads Less Traveled - Ballston Beach 7/19/14,Nature Tour,Hike: Roads Less Traveled - Ballston Beach 7/19/14,180,false,2014-06-19,2018-06-14
16,233338,USS Arizona Memorial,Historic Tour,"World War II Valor in the Pacific National Monument was established to preserve a series of sites which tell the story of the war between the U.S. and Japan in the Pacific.<br> The monument protects nine sites in three states. The Hawaii sites include Battleship Row in Pearl Harbor, the USS Arizona Memorial, the USS Oklahoma Memorial, the USS Utah Memorial and six Chief Petty Officer bungalows on Ford Island.  Pearl Harbor Memorial TheaterThe Pearl Harbor Memorial Theater is located across from the two exhibit galleries. As part of the 75-minute USS Arizona Memorial program (immediately preceding the boat trip to the actual Memorial), visitors will enter the theater to view a 23-minute documentary film on the December 7, 1941 attack.",45,true,2014-05-02,2022-03-02
161,250795,"Surfcasting 101, Eastham",Nature Tour,Surfcasting 101,90,false,2014-06-19,2019-06-23
163,250795,Hike: Roads Less Traveled - Bound Brook Island 8/16/14,Nature Tour,Hike: Roads Less Traveled - Bound Brook Island 8/16/14,180,false,2014-06-19,2018-06-14
164,250795,"Fish, Snails, and Horseshoe Crab Tales, Eastham",Nature Tour,"Fish, Snails, and Horseshoe Crab Tales: Wellfleet",90,false,2014-06-19,2019-06-23
165,250795,"Yoga on the Beach: Nauset Light Beach, Eastham",Nature Tour,Yoga on the Beach: Eastham,75,false,2014-06-19,2019-06-23
166,233274,Family Sleepover,Historic Tour,"For the first time since its establishment as a national park site in 1908, campers seeking overnight shelter will be invited to stay the night within the walls of Mission San Jos de Tumaccori.  Camping out under the stars is a beloved tradition in national parks, says Superintendent Bob Love, We are so excited to offer visitors the chance not just to camp here at Tumaccori, but to experience this place the way travellers did over one hundred years ago.",870,false,2014-07-10,2018-06-14
17,233338,USS Arizona Memorial Education Tour,Historic Tour,"World War II Valor in the Pacific National Monument was established to preserve a series of sites which tell the story of the war between the U.S. and Japan in the Pacific.<br> The monument protects nine sites in three states. The Hawaii sites include Battleship Row in Pearl Harbor, the USS Arizona Memorial, the USS Oklahoma Memorial, the USS Utah Memorial and six Chief Petty Officer bungalows on Ford Island.  Pearl Harbor Memorial TheaterThe Pearl Harbor Memorial Theater is located across from the two exhibit galleries. As part of the 75-minute USS Arizona Memorial program (immediately preceding the boat trip to the actual Memorial), visitors will enter the theater to view a 23-minute documentary film on the December 7, 1941 attack.",75,true,2014-05-02,2022-03-02
170,233362,Oak Tree House,Cliff Dwelling Tour,"This 60-room site built on two ledges is one of the largest cliff dwellings in the park. Oak Tree House is a well preserved but fragile site that features plastered walls and varied architectural styles.<br><br>This tour is available from May 3rd, 2016 to May 28th, 2016 on Tuesdays and Saturdays and September 12th, 2016 to October 16th, 2016 on Mondays and Fridays. Meet the ranger for your hike at Sun Temple Overlook no later then 7:45 am. Hikers for Oak Tree House depart promptly at 8:00 am. Drive time from the park entrance is approximately one hour.",120,false,2015-02-12,2018-06-14
172,233266,Dripstone Trail Photo Tour,Cave Tour,"The Dripstone Trail Photo Tours allow for the use of time exposures, tripods, and other photo equipment. The tours provide time but not instruction for cave photography. There is no group rate for this tour.",240,false,2015-04-09,2018-06-14
173,233266,Discovery Trail Photo Tour,Cave Tour,"The Discovery Trail Photo Tours allow for the use of time exposures, tripods, and other photo equipment. The tours provide time but not instruction for cave photography. There is no group rate for this tour.",240,false,2015-04-09,2018-06-14
174,233362,Wetherill Mesa Bike and Hike Adventure,Natural and Cultural Hike,"If you like both hiking and biking, this is the trip for you. This ranger-guided, 4.5 hour trek on the quieter side of Mesa Verde includes about 5 miles (8.1 km) of biking and 4 miles (6.4 km) of hiking. Expansive canyon views, spectacular overlooks of remote cliff dwellings, and a tour of magnificent Long House are all part of this adventure.<br><br>This tour is available from Wednesday, June 1st, 2016 to Sunday, September 4th, 2016 on Wednesdays and Sundays. It departs from the Wetherill Mesa parking lot. Meet the ranger at the picnic shelter by the restrooms at least 15 minutes advance. Total distance from the park entrance is 27 miles (43 km). Allow an hour and 15 minutes travel time from the park entrance. The group will leave promptly at 9:30 am.<br><br>Vehicles on this road are restricted to less than 8,000 pounds and 25-feet in length.",270,false,2015-04-09,2018-06-14
175,233373,Winter Snowshoe Hike on Santiam Pass ,Nature Tour,"Explore what early travel was like in the forest in the historic Santiam River Area that once linked the Willamette Valley to eastern Oregon. The exact route will depend on snow conditions.  Conditions can be tough, no novices please.",480,false,2015-04-09,2018-06-14
176,233373,Art in the Great Outdoors ,Nature Tour,"Take a hike to the edge of the Middle Santiam Wilderness.  Photographers and artists bring your supplies and be prepared to hike in with them.  Enjoy a flowing river, old growth forest, and a swimming hole.",480,false,2015-04-09,2018-06-14
177,233373,General Outdoor Preparedness,Nature Tour,Learn skills on how to survive an outdoor emergency in Western Oregon.,480,false,2015-04-09,2018-06-14
178,233373,Browder Ridge and Heart Lake ,Nature Tour,"Hike through old growth Douglas-fir forest to subalpine meadows with great views of the Cascade peaks, with a side trip into Heart Lake.",480,false,2015-04-09,2018-06-14
179,251573,Guided Tour of Theodore Roosevelts Home,Historic Tour,A Guided Tour of Theodore Roosevelts Home provided park staff or a volunteer ,45,true,2015-05-21,2018-06-14
18,233338,Narrated Tour,Historic Tour,"A newly-updated audio tour narrated by actress Jamie Lee Curtis, daughter of actor and Pacific War veteran, Tony Curtis. The audio tour provides narration throughout the visitor center, interpretive exhibit galleries, and waterfront interpretive displays, in addition to providing interpretive information on the shuttle boats and on the Memorial. Featuring guest narration by actual Pearl Harbor Survivors and National Park Service Historian Daniel Martinez, the audio tour is recommended for all visitors waiting for their program to begin.<br><br>For visitors interested in the audio tour, headsets are available for rent at the booth to the left of the NPS Tickets and Information Desk. The audio tour is available in seven languages: English, French, Japanese, Korean, Mandarin, German, and Spanish.",0,true,2014-05-02,2022-03-02
180,251573,Large Group/Commercial Group Tour of Theodore Roosevelts Home,Historic Tour,A Guided Tour of Theodore Roosevelts Home provided by park staff or a volunteer for commercial bus or other tour companies.,150,true,2015-05-21,2018-06-14
182,251610,Discovery Tour,Cave Tour,"Squeeze through the narrow twisting passages of the Oregon Caves. See glistening flowstone and weird hanging curtains of rock. Discover the complex geology of the Siskiyou Mountains from the inside-out. Learn about cave life and the fossils found within these marble halls. But above all, or should we say under all, come and have an adventure! ",90,false,2015-06-25,2018-06-14
183,251610,Candlelight Cave Tour,Historic Tour,"On summer Fridays and Saturdays, the last tour of the day is conducted by candle light. This gives visitors (ages 12 and over) a chance to see what early explorers of the cave might have seen as they went from room to room with a candle.",60,false,2015-06-25,2018-06-14
184,251610,Off-Trail Tour,Cave Tour,"Experience the wondrous, wild areas of Oregon Caves National Monument off trail! Trained guides will teach you caving techniques, cave etiquette, and bring you face-to-face with the marble structure of Oregon Caves. This three-hour experience through tight squeezes and crawls will challenge and exhilarate you! This is a very strenuous, adventurous experience. Scramble boulders, belly crawl, negotiate uneven rock piles, and squeeze yourself through confined cave passages as small as 11 inches by 19 inches. The only source of light is your caving headlamp!",210,false,2015-06-25,2018-06-14
185,234640,Cleaveland Avenue,Cave Tour,"Descend nearly 200 stairs at the Carmichael Entrance, pass the craggy breakdown of the Rocky Mountains and enter gypsum encrusted Cleaveland Avenue. This tour showcases gypsum in various crystalline shapes and sizes. The beautifully elliptical Cleaveland Avenue terminates in the Snowball Dinning Room, viewed by visitors since 1840s. Visitors retrace Cleaveland Avenue, ascending nearly 200 stairs to the Carmichael Entrance. The entire route is seen on the Grand Avenue Tour. Restroom facilities and water fountains will be available in the Snowball Room. However, no food or beverages, other than water are permitted or provided.",150,false,2015-09-03,2018-06-14
187,251745,Accessible Wheelchair ONLY Tour,Historic Tour,"Access to Rapidan Camp involves traveling on a Park-operated van on a seven-mile unpaved administrative road. For this reason, visitors must join a Ranger-guided program to travel to the site. A ranger guided tour of Rapidan Camp includes time inside both the Brown House and the Prime Ministers Cabin, as well as time exploring the grounds and gardens within the Historic Landmark. The shuttle ride is approximately 30 minutes each way. Total tour time (including travel) is 2.5 hours. Tours can be reserved up to a week in advance. Seating is limited, so early reservations are recommended. These popular programs do require some walking and standing on level ground during the tour. Many tours are accessible and can accommodate a wheelchair on the shuttle and at the site.",150,true,2015-09-10,2018-06-14
188,251745,Historic Rapidan Camp Tour,Historic Tour,"Access to Rapidan Camp involves traveling on a Park-operated van on a seven-mile unpaved administrative road. For this reason, visitors must join a Ranger-guided program to travel to the site. A ranger guided tour of Rapidan Camp includes time inside both the Brown House and the Prime Ministers Cabin, as well as time exploring the grounds and gardens within the Historic Landmark. The shuttle ride is approximately 30 minutes each way. Total tour time (including travel) is 2.5 hours. Tours can be reserved up to a week in advance. Seating is limited, so early reservations are recommended. These popular programs do require some walking and standing on level ground during the tour. Many tours are accessible and can accommodate a wheelchair on the shuttle and at the site.",150,false,2015-09-10,2018-06-14
189,251573,Group Tour of Theodore Roosevelts Home for Educational Institutions,Historic Tour,A Guided Tour of Theodore Roosevelts Home provided by park staff or a volunteer  for non-commercial educational groups from schools and other bona fide academic institutions.,150,true,2015-09-10,2018-06-14
19,233338,Passport,Historic Tour,"Consider combining with your upcoming visit to the USS <i>Arizona</i> Memorial with the ability to access the Battleship <i>Missouri</i> Memorial, USS <i>Bowfin</i> Submarine Museum, and the Pacific Aviation Museum at Pearl Harbor. The USS <i>Arizona</i> Memorial does not charge a use fee, but there are charges for the Battleship <i>Missouri</i> Memorial, USS <i>Bowfin</i> Submarine Museum and Pacific Aviation Museum, which are operated by private, non-profit groups.<br><br>If you plan to visit all four of the facilities, please allow a minimum of five (5) hours for the complete Pearl Harbor experience. You may wish to allot some additional time to rest between tours, enjoy a bite to eat, and to visit our gift shops.",0,true,2014-05-02,2022-03-02
192,234635,WALK-UP Washington Monument,Historic Tour,WALK-UP Washington Monument,30,true,2015-11-12,2018-06-14
193,234635,2016 Washington Monument,Historic Tour,2016 Washington Monument,30,true,2015-11-12,2018-06-14
194,251853,Grand Palace,Cave Tour,.,90,false,2016-02-04,2018-06-14
195,251853,First Room,Cave Tour,.,30,true,2016-02-04,2018-06-14
196,251853,Lodge Room,Cave Tour,.,60,false,2016-02-04,2018-06-14
197,251853,Gothic Palace - Accessible,Combo Tour,1st Room,0,false,2016-02-04,2018-06-14
199,251898,Family Tour,Cave Tour,"After passing through the spider web gate, your guide will give you a brief history of the Cave and point out unique features and formations. You will then be led from room to room on paved, lighted pathways, pausing to listen to the water and echoes in the Cave in total darkness.",50,false,2016-02-11,2018-06-14
2,234787,Summer Solstice,Historic Tour,Observe the summer solstice amid the ancient ruins of Chimney Rock mesa.  Attendees enter the National Monument in pre-dawn darkness and meet a volunteer program leader who will escort them to two special places on Chimney Rock mesa. ,120,false,2014-05-02,2018-06-14
20,233373,Birding in Your Parks Series: Riverbend County Park & Cascadia State Park,Nature Hike,"Birdwatching for beginners at Park locations.  Learn how to identify birds by sight and sound, along with learning habitat for resident and migratory species.",360,false,2014-05-02,2018-06-14
200,251898,Junior Caver Tour,Cave Tour,"On this tour, your child will learn about the world of cave exploration by participating in his/her own cave adventure! Young explorers will be provided with all the necessary gear- helmet, kneepads, light- before entering the Cave with two trained naturalists. The group will leave the paved trail, away from the tour lights, for a short trip to The Well that lies below the main level of Crystal Cave. Cavers must be in good physical condition, able to climb over large rocks and have no fear of small or enclosed spaces. Participants should expect to get dirty!",150,false,2016-02-11,2018-06-14
2000,300009,Three Sisters - Broken Top Trailhead,Hike,This trail passes through fragile alpine terrain on the south slopes of the glacier-carved Broken Top Volcano.,1140,false,2020-02-13,2022-05-03
2001,300009,Three Sisters - Crater Ditch Trailhead,Hike,This is an alternative trailhead to the Broken Top trailhead,1140,false,2020-02-13,2022-05-03
2002,300009,Devils Lake/Wickiup Trailhead (South Sister),Hike,"This accesses the South Sister Climbers Trail, Devils Lake Trail, and the Wickiup Plains Trail.",1140,false,2020-02-13,2022-05-03
2003,300009,Three Sisters - Green Lake/Soda Creek Trailhead,Hike,This accesses the Green Lakes and Soda Creek Trails.,1140,false,2020-02-13,2022-05-03
2004,300009,Three Sisters - Lava Camp Trailhead,Hike,Provides access to: Pacific Crest Trail #2000 and Millican Crater Trail ,1140,false,2020-02-13,2022-05-03
2005,300009,Three Sisters - Obsidian Trailhead,Hike,"Provides access to: Pacific Crest Trail #2000, Obsidian Trail #3528, and Scott Trail #3531",1140,false,2020-02-13,2022-05-03
2006,300009,Three Sisters - Scott Trailhead,Hike,"Provides access to: Pacific Crest Trail #2000, Obsidian Trail #3528, and Scott Trail #3531",1140,false,2020-02-13,2022-05-03
2007,300009,Three Sisters - Sisters Mirror Trailhead,Hike,This small trailhead offers access to Sisters Mirror Lake within the Three Sisters Wilderness. This trail also offers access to the Pacific Crest Trail.,1140,false,2020-02-13,2022-05-03
2008,300009,Three Sisters - Tam McArthur Rim Trailhead,Hike,Provides access to: Tam McArthur Trail #4078 ,1140,false,2020-02-13,2022-05-03
2009,300009,Three Sisters - Todd Lake Trailhead,Hike,Todd Lake is a short walk from the parking area and offers views of Broken Top.  Access Three Sisters Wilderness with the Todd Trail climbing towards Soda Creek and Broken Top.,1140,false,2020-02-13,2022-05-03
201,251898,Discovery Tour,Cave Tour,Get an in-depth experience of Crystal Caves geology and the interesting plants and animals living in and around the Cave. Participants meet their naturalist at the beginning of the trail and the group proceeds on their ecosystem exploration inside the Cave. The Cave portion of the tour is led by flashlight. Flashlights provided.,90,false,2016-02-11,2018-06-14
2010,300009,Mt. Jefferson - Duffy Lake Trailhead,Hike,Trailhead for Duffy Lake Trail #3427,1140,false,2020-02-13,2022-05-03
2011,300009,Mt. Jefferson - Jack Lake Trailhead (Canyon Creek Meadows),Hike,This trail is located near Jack Lake and provides access to Mt. Jefferson Wilderness via Summit Lake Trail #4014. ,1140,false,2020-02-13,2022-05-03
2012,300009,Mt. Jefferson - Marion Lake Trailhead,Hike,Trailhead for Marion Lake Trail #3436,1140,false,2020-02-13,2022-05-03
2013,300009,Mt. Jefferson - Pamelia Lake Trailhead,Hike,"This trailhead provides access to: Pamelia Lake Trail #3439, Grizzly Peak Trail #3428, Hunts Creek Trail #3440, Hunts Cove Trail #3430, Old Hunts Cove Trail #3451, Pacific Crest Trail #2000",1140,false,2020-02-13,2022-05-03
2014,300009,Mt. Jefferson - PCT Breitenbush / Breitenbush Lake Trailhead,Hike,This trailhead provides access to: Pacific Crest Trail #2000,1140,false,2020-02-13,2022-05-03
2015,300009,Mt. Jefferson - Breitenbush Trailhead,Hike,"This trailhead provides access to: South Breitenbush Trail #3375, Bear Point Trail #3342, South Breitenbush Gorge Trail #3366, Crag Trail #3364",1140,false,2020-02-13,2022-05-03
2016,300009,Mt. Jefferson - Whitewater Trailhead,Hike," Trailhead provides access for: Whitewater Trail #3429, Triangulation Trail #3373, Triangulation Peak Trail #3374, Cheat Creek Trail #3441, Crag Trail #3364, Pacific Crest Trail #2000",1140,false,2020-02-13,2022-05-03
2017,300009,Mt. Washington - Benson/Tenas Trailhead,Hike,"This trailhead provides access to: Benson Lake Trail #3502, Hand Lake Trail #3513, Scott Mountain Trail #4339",1140,false,2020-02-13,2022-05-03
2018,300009,Mt. Washington - PCT McKenzie Pass Trailhead,Hike,This trailhead provides access to: Pacific Crest Trail #2000,1140,false,2020-02-13,2022-05-03
202,251898,Wild Cave Tour,Cave Tour,"Explore off-trail, crawl, and climb through passageways, over steep drop-offs and past intricate formations on a belly-crawling tour. This tour gives you the opportunity to learn about Sierran caves first hand. Your cave guide will explain how the delicate formations such as soda straws, rimstone dams and cave pearls are formed. Experience total darkness and silence interrupted only by the rhythmic sounds of dripping and flowing water. Expect to come away with great memories, new knowledge and insight, intermingled with sore muscles and a thick coating of dirt from head to toe. All participants must be in good physical condition to participate.",270,false,2016-02-11,2018-06-14
2030,300010,Mount Rushmore Independence Event,Nature Tour,Mount Rushmore Independence Event,0,true,2020-04-06,2020-04-06
2040,300011,Mill & Trolley Tour,Nature Tour,"Witness the machine that drove 19th century textile mills - a working hydro-turbine in the former Suffolk Mill.  Hear about the women and men who came to Lowell to operate the mills and in doing so redefined the meaning of work. Discover how all of these events shaped the city's past and its present. Tour combines a trolley ride, a short walk, and a guided visit to the River Transformed exhibit at the Wannalancit Mill. The open trolley car is a historic reproduction and accessible for one wheelchair or mobility device. Please call 978-970-5000 for more information. Tours May 4- June 5: Begin at the Boott Cotton Mills Museum, 115 John St. Tours June 7- September 5: Begin at the Visitor Center, 246 Market St. Tours September 8- October 9: Begin at the Boott Cotton Mills Museum, 115 John St.*Locations are subject to change due to construction projects. Please call 978-970-5000 to verify where your tour will begin.",90,true,2020-04-09,2020-04-09
2041,300011,Canal Boat Tour,Boat Tour,"Discover the human stories of Lowell's remarkable waterpower system. Using pick-axes, shovels and explosives, workers engineered more than five miles of canals to power the textile mills of Lowell. Learn about the creative problem solving that made Lowell successful and continues to shape the city today. Canal boat tours travel up and down the Pawtucket Canal with a locking demonstration through the historic Guard Locks. When making a reservation, please include all individuals in your party including infants. Check in for your tour at the Visitor Center, 246 Market St., 15 minutes before your scheduled departure.",90,true,2020-04-09,2020-04-09
205,233362,Balcony House Sunrise Tour,Cliff Dwelling Tour,"Begin your day as the Ancestral Pueblo people have for generations. Climb into Balcony House as the sun rises, and step into the 21st Century of our national parks. The tour begins at the north end of the Balcony House parking lot, a 24-mile (38.6 km), 1 to 11/4 hour drive from park entrance. Meet the ranger at the benches under shade structure at Balcony House at least 15 minutes in advance of start of tour.<br><br>Dress warmly and bring a flashlight. Cameras are welcome, but you must be able to carry all of your gear while keeping your hands free to climb the ladders.<br><br>The tour is available on May 7th, June 20th, June 21st, September 21st, September 22nd, and October 10th.",90,false,2016-02-25,2018-06-14
2050,300012,Civil War Heritage Explorer - Gouldsboro Excursion,Historic Tour,Take train to the Gouldsboro Train Station Museum. Learn about Pennsylvania's role in the Civil War history. Volunteers will be dressed  in period costume. Food and light refreshments are available for purchase.,240,true,2020-05-04,2020-05-04
2051,300012,Penn Division Explorer - Archbald Excursion,Historic Tour,"Explore the history of the D & H and O & W Railroads. Visit remnants of the D & H Gravity Railroad and the Powder Mill Preserve. Learn about the efforts of the Lackawanna Heritage Valley Authority to preserve over 100,000 acres of natural  and scenic watershed lands.",300,true,2020-05-04,2020-05-04
2052,300012,Heart of the Poconos Limited - Cresco Excursion,Historic Tour,"Ride the train to the quaint Pocono hamlet of Cresco, PA. Tour the Cresco Station Museum and the Barrett township Research Library.  Enjoy live music.  Light refreshments are available for purchase.",240,true,2020-05-04,2020-05-04
2053,300012,Scouting Express - Tobyhanna Morning Excursion,Historic Tour,Take the train to the top of the Pocono Plateau and the quaint village of Tobyhanna.  There will be a short 30 minute layover before the return trip back to Steamtown NHS.,210,true,2020-05-04,2020-05-04
2054,300012,Scouting Express - Steamtown Excursion,Historic Tour,Take a train ride from the quaint villiage of Tobyhanna to Steamtown NHS.,210,true,2020-05-04,2020-05-04
2055,300012,Scouting Express - Tobyhanna Afternoon Excursion,Historic Tour,Take a train ride from the quaint villiage of Tobyhanna to Steamtown NHS.,3,true,2020-05-04,2020-05-04
2056,300012,Country Street Fair Flyer - Moscow Excursion,Historic Tour,"Take the train ride to the Moscow Country Street Fair.  Arts, crafts and food are available for purchase.",180,true,2020-05-04,2020-05-04
